{
  "description": "Preserve frozen route identity for a Temporal workflow/activity adapter.",
  "id": "adapter.orchestrator.temporal",
  "integration_model_version": "0.1",
  "limitations": [
    "The export is a portable manifest, not deployable native code; an authorized adapter must enforce runtime, secret, retry, and isolation policy."
  ],
  "output_kind": "projection.frozen-plan",
  "source_kind": "orchestrator.temporal",
  "supported_versions": [
    "1"
  ]
}
